{"candidate_horizons_ns":[250000000,1000000000,5000000000],"config_sha256":"218d71bb2d5580c4b385ed75733e3586f541b21826023014bde08b044a1707d8","dataset_id":"step21-prediction-validation","exact_historical_queue_used":false,"feature_count":20,"feature_dictionary_sha256":"955af2173a02d5c28e14b65b87d404c7fa329bd5230f399f81701706f6feb73a","features_and_labels_physically_separated":true,"future_information_used_in_features":false,"input_events_sha256":"a2293a0c296e255060993e501b9656a442181fcec3499f3bc91e859812550439","primary_target":"best_quote_depletion_or_trade_through","research_admissible":false,"research_blockers":["zero_admitted_live_days","gate_c_not_open"],"research_status":"synthetic_validation_only_non_research","row_count":8,"schema_version":"prediction-dataset-manifest-v1","secondary_target":"side_signed_post_event_adverse_selection","selected_horizon":"PRE_DATA_FIELD_BEFORE_CALIBRATION","software_version":"0.14.0","step":21,"symbols":["BTCUSDT","ETHUSDT"],"tables":[{"compressed_bytes":1148,"data_relative_path":"tables/prediction_features/columns.json.gz","data_sha256":"58129413f02434fc759ef9ed8385d41a94636a78717d6937bce97c1cb9e10abd","row_count":8,"schema_relative_path":"tables/prediction_features/schema.json","schema_sha256":"fbc7529f7a89e4583f71f7426c2f69f5fe7373a8925cf339c539c680fd449028","table_name":"prediction_features","uncompressed_bytes":3826},{"compressed_bytes":557,"data_relative_path":"tables/prediction_labels/columns.json.gz","data_sha256":"19950dfae19dcf929269232ede10357013ff224608cfa228dee80595d1b64e63","row_count":8,"schema_relative_path":"tables/prediction_labels/schema.json","schema_sha256":"c0b9af55d4e6a77d5bd444f6467eee235da0c80deab2eff845916fff5dd1ec2f","table_name":"prediction_labels","uncompressed_bytes":1421}]}
